Country_Name,Power_Status,Fictional_Backstory,Global_Influence_Level,Unique_Advantages,LSW_Specialization,Economic_Power,Military_Capability,Cultural_Influence,Player_Benefits
Greece,Ancient_Wisdom_Superpower,Discovery of ancient Greek LSW enhancement temples containing alien technology from classical era,9/10 Global Influence,"Ancient alien technology; Mystical LSW enhancement; Philosophical wisdom networks","Mystical enhancement; Reality manipulation; Ancient knowledge powers",Very High - Controls Mediterranean trade and ancient tech patents,Advanced - Ancient military tactics enhanced with LSW powers,Extreme - Greek philosophy and ancient wisdom respected globally,"+4CS mystical investigation; Ancient knowledge access; Mediterranean authority; Philosophical networks"
Uganda,Genetic_Enhancement_Leader,Ugandan genetic research breakthrough creates most advanced LSW enhancement program globally,8/10 Global Influence,"Genetic LSW enhancement; Medical advancement; African continental leadership","Genetic manipulation; Biological enhancement; Medical LSW powers",High - Genetic technology exports and medical tourism,Moderate - Continental defense and peacekeeping,High - African development model and genetic medicine leadership,"+3CS biological investigation; Genetic enhancement access; African authority; Medical advancement"
Vatican_City,Spiritual_Authority_Center,Vatican becomes global center for spiritual LSW enhancement and divine power research,7/10 Religious Influence,"Divine power research; Spiritual LSW enhancement; Global religious authority","Divine blessing; Spiritual protection; Religious healing powers",Moderate - Religious economy and spiritual tourism,Low - Swiss Guard with divine enhancement,Extreme - Global religious authority and spiritual guidance,"+4CS spiritual investigation; Divine protection; Global religious authority; Blessed equipment"
Singapore,Technology_Innovation_Hub,Singapore becomes global center for LSW-technology integration and cybernetic enhancement,8/10 Technological Influence,"Cybernetic LSW integration; Digital enhancement; Technology research","Cybernetic enhancement; Digital powers; Technology integration",Very High - Technology exports and digital services,Moderate - Cybernetic defense systems,High - Technology innovation and digital culture,"+3CS technology investigation; Cybernetic enhancement; Digital authority; Innovation access"
New_Zealand,Environmental_Guardian,New Zealand becomes global environmental protection leader with nature-powered LSW program,6/10 Environmental Influence,"Environmental LSW powers; Ecological protection; Natural harmony","Nature control; Environmental manipulation; Ecological LSW powers",Moderate - Eco-technology and environmental services,Low - Environmental defense and protection,High - Environmental movement leadership and ecological authority,"+3CS environmental investigation; Nature power access; Ecological authority; Environmental protection"
Switzerland,Neutral_Mediation_Power,Switzerland becomes ultimate neutral mediator for LSW conflicts with reality-stabilizing powers,7/10 Diplomatic Influence,"Reality stabilization; Neutral mediation; Dimensional anchor technology","Reality anchoring; Dimensional stability; Peaceful resolution powers",Very High - Banking and mediation services,Low - Defensive reality anchors only,Moderate - Neutral mediation and diplomatic authority,"+4CS diplomatic investigation; Reality stability; Neutral authority; Mediation access"
Israel,Intelligence_Supremacy,Israeli intelligence services develop ultimate LSW intelligence network with precognitive powers,8/10 Intelligence Influence,"Precognitive intelligence; Advanced surveillance; Information warfare","Precognition; Intelligence enhancement; Information manipulation powers",High - Intelligence technology and information services,Very High - Intelligence-enhanced defense,Moderate - Intelligence culture and information authority,"+4CS intelligence investigation; Precognitive access; Information authority; Advanced surveillance"
Monaco,Corporate_LSW_Haven,Monaco becomes tax haven and headquarters for corporate LSW operations and mega-corp LSW programs,6/10 Economic Influence,"Corporate LSW programs; Tax haven status; Luxury LSW services","Corporate enhancement; Luxury powers; Economic manipulation",Very High - Corporate services and luxury LSW enhancement,Low - Corporate security only,Moderate - Luxury culture and corporate authority,"+3CS corporate investigation; Luxury access; Economic authority; Corporate networks"
Iceland,Geological_Power_Center,Iceland's unique geology provides geothermal LSW enhancement and earth-power amplification,5/10 Specialized Influence,"Geothermal LSW enhancement; Geological powers; Earth energy manipulation","Earth manipulation; Geological control; Geothermal powers",Moderate - Energy exports and geological services,Low - Geological defense systems,Low - Environmental culture and geological authority,"+2CS geological investigation; Earth power access; Geothermal enhancement; Environmental authority"
Bhutan,Happiness_Philosophy_Power,Bhutan's Gross National Happiness philosophy creates emotional LSW enhancement and peace powers,4/10 Cultural Influence,"Emotional LSW enhancement; Happiness philosophy; Peace and harmony powers","Emotional manipulation; Peace powers; Harmony enhancement",Low - Happiness tourism and philosophical services,Very Low - Peaceful defense only,High - Happiness philosophy and emotional authority,"+3CS emotional investigation; Peace power access; Happiness authority; Emotional enhancement"
Malta,Maritime_LSW_Hub,Malta becomes central Mediterranean maritime LSW operations base with naval powers,3/10 Regional Influence,"Maritime LSW operations; Naval power enhancement; Mediterranean authority","Water manipulation; Naval powers; Maritime enhancement",Moderate - Maritime services and naval LSW enhancement,Moderate - Maritime defense and naval operations,Low - Maritime culture and naval authority,"+2CS maritime investigation; Naval power access; Mediterranean authority; Maritime operations"
Luxembourg,Financial_LSW_Center,Luxembourg becomes European financial center for LSW operations with economic powers,5/10 Financial Influence,"Financial LSW operations; Economic power enhancement; European banking","Economic manipulation; Financial powers; Monetary control",Very High - Financial services and economic LSW enhancement,Low - Financial security only,Low - Financial culture and economic authority,"+3CS financial investigation; Economic power access; Financial authority; Banking networks"
Liechtenstein,Reality_Research_Lab,Liechtenstein becomes secret reality research laboratory with dimensional powers,4/10 Scientific Influence,"Reality research; Dimensional experimentation; Physics manipulation","Reality warping; Dimensional powers; Physics manipulation",Low - Reality research and dimensional services,Low - Reality defense systems,Very Low - Scientific culture and reality authority,"+4CS reality investigation; Dimensional access; Reality research; Physics manipulation"
San_Marino,Ancient_Republic_Authority,San Marino's ancient republican traditions provide governmental LSW enhancement,2/10 Historical Influence,"Ancient governance; Republican traditions; Political LSW enhancement","Political manipulation; Governance powers; Administrative enhancement",Low - Political consulting and governance services,Very Low - Administrative defense only,Low - Republican culture and governance authority,"+2CS political investigation; Governance access; Republican authority; Administrative enhancement"
Andorra,Mountain_Fortress_Defense,Andorra becomes mountain fortress defense specialist with terrain manipulation powers,2/10 Defensive Influence,"Mountain defense; Terrain manipulation; Fortress LSW enhancement","Terrain control; Mountain powers; Defensive enhancement",Low - Defense consulting and mountain services,Moderate - Mountain fortress defense,Very Low - Mountain culture and defensive authority,"+2CS mountain investigation; Terrain power access; Defensive authority; Mountain operations"
Major_Power_Greece,Superpower_Status,Greece emerges as global superpower through ancient alien technology discovery,9/10 Global Influence,"Ancient Greek temples contain alien LSW enhancement technology; Philosophical networks provide global wisdom authority; Mediterranean becomes Greek sphere","Ancient wisdom powers; Mystical enhancement; Philosophical authority; Reality manipulation through classical understanding",Very High - Controls global philosophy and ancient technology trade,High - Ancient military tactics enhanced with modern LSW capabilities,Extreme - Greek philosophy and classical wisdom globally respected,All Mediterranean operations; Ancient knowledge bonuses; Global philosophical authority; Reality manipulation research
Major_Power_Uganda,Continental_Leader,Uganda becomes African continental leader through genetic LSW breakthrough,8/10 Continental Influence,"Ugandan genetic research creates most advanced LSW enhancement; African unity under Ugandan leadership; Continental resource control","Genetic manipulation; Biological enhancement; African unity powers; Continental authority",High - Genetic technology and African resource control,Moderate - African continental defense and unity enforcement,High - African development model and genetic advancement,All African operations; Genetic enhancement access; Continental authority; African unity networks
Regional_Power_Portugal,Maritime_Empire_Revival,Portugal revives maritime empire through oceanic LSW powers and Atlantic control,6/10 Atlantic Influence,"Portuguese oceanic research discovers water-based LSW enhancement; Atlantic maritime authority; Lusophone network","Oceanic powers; Water manipulation; Maritime authority; Atlantic control",Moderate - Atlantic trade and maritime services,Moderate - Atlantic maritime defense and oceanic operations,Moderate - Portuguese culture and maritime authority,Atlantic operations; Oceanic power access; Maritime authority; Lusophone networks
Regional_Power_Kazakhstan,Central_Asian_Hub,Kazakhstan becomes Central Asian power hub through energy LSW research and Silk Road control,5/10 Regional Influence,"Kazakhstani energy research creates energy LSW enhancement; Central Asian authority; New Silk Road control","Energy manipulation; Resource control; Central Asian authority; Trade route powers",High - Energy resources and Central Asian trade,Moderate - Regional defense and trade route security,Low - Central Asian culture and trade authority,Central Asian operations; Energy power access; Trade authority; Resource networks
Fictional_Alliance_Mediterranean,Greece_Cyprus_Malta,Greek-led Mediterranean alliance controlling ancient technology and maritime trade,7/10 Regional Dominance,"Mediterranean becomes unified under Greek leadership; Ancient technology sharing; Maritime trade control","Combined ancient wisdom; maritime power; reality manipulation",Very High - Mediterranean trade monopoly,High - Combined Mediterranean defense,High - Classical culture and maritime authority,Complete Mediterranean authority; Ancient technology access; Maritime trade control
Fictional_Alliance_African_Unity,Uganda_Nigeria_Ethiopia,African continental alliance under Ugandan genetic leadership and Nigerian diplomatic authority,8/10 Continental Dominance,"African unity under joint Ugandan-Nigerian leadership; Continental resource control; Genetic advancement sharing","Combined genetic enhancement; diplomatic authority; continental unity",Very High - African resource monopoly,Moderate - Continental defense unity,High - African development and genetic advancement,Complete African authority; Genetic enhancement access; Continental resource control
Fictional_Alliance_Scandinavian_Tech,Sweden_Norway_Denmark,Scandinavian technology alliance with advanced LSW research and environmental powers,6/10 Regional Technology,"Scandinavian cooperation creates advanced environmental LSW technology; Nordic authority; Arctic control","Environmental technology; Arctic powers; Social democracy enhancement",High - Environmental technology and Arctic resources,Moderate - Nordic defense and Arctic operations,High - Social democracy and environmental authority,Nordic operations; Environmental technology; Arctic authority; Social democracy networks
Fictional_Conflict_Balkans,Greece_vs_Turkey_Serbia,Balkan power struggle with Greece's ancient power vs Turkish and Serbian resistance,5/10 Regional Tension,"Greek expansion using ancient power conflicts with Turkish and Serbian nationalism; Balkan instability","Ancient power vs nationalist resistance; Religious conflict; Territorial disputes",Moderate - Regional economic competition,Moderate - Regional military tension,High - Religious and cultural conflict,Balkan operations complicated; Religious tensions; Ancient vs modern authority conflict
Fictional_Conflict_Horn_Africa,Uganda_vs_Egypt_Sudan,East African power struggle over Nile resources and continental authority,6/10 Regional Resource War,"Ugandan continental authority conflicts with Egyptian historical dominance; Nile resource control; Ancient vs genetic power","Genetic enhancement vs ancient authority; Resource control; Continental vs regional power",High - Nile resource control competition,Moderate - Regional military buildup,Moderate - Ancient vs modern African authority,East African operations; Nile authority; Ancient vs genetic power competition
Economic_Fiction_Cryptocurrency,Switzerland_Digital_Currency,Swiss development of LSW-enhanced cryptocurrency creates global financial revolution,7/10 Financial Revolution,"Swiss LSW-enhanced cryptocurrency provides ultimate financial security; Reality-anchored digital currency; Global financial authority","Reality-anchored economics; Dimensional financial security; Ultimate monetary authority",Very High - Global financial system control,Low - Financial security only,Moderate - Financial innovation authority,Global financial authority; Reality-anchored currency; Ultimate economic security
Cultural_Fiction_Language,Greece_Philosophy_Revival,Greek philosophical revival creates global wisdom authority and ancient knowledge renaissance,6/10 Cultural Renaissance,"Greek philosophy becomes global authority; Ancient wisdom networks; Classical education revival","Ancient wisdom authority; Philosophical networks; Classical knowledge enhancement",Moderate - Educational and cultural services,Low - Cultural defense only,Very High - Global philosophical and educational authority,Global educational authority; Ancient wisdom access; Classical knowledge networks
Environmental_Fiction_Antarctica,International_Environmental,Antarctica becomes international environmental LSW research center with cosmic environmental authority,5/10 Environmental Authority,"Antarctic international cooperation creates environmental LSW research; Cosmic environmental authority; Climate control powers","Environmental cosmic authority; Climate manipulation; International environmental cooperation",Low - Research and environmental services only,Low - Environmental defense only,Moderate - Environmental movement authority,International environmental authority; Climate control research; Cosmic environmental powers
Religious_Fiction_Tibet,Tibet_Spiritual_Authority,Tibetan spiritual authority creates global meditation and enlightenment LSW enhancement,4/10 Spiritual Influence,"Tibetan spiritual practices enhance LSW meditation and enlightenment; Global spiritual authority; Inner peace powers","Meditation enhancement; Spiritual enlightenment; Inner peace powers; Wisdom authority",Low - Spiritual services and meditation enhancement,Very Low - Peaceful spiritual defense,High - Spiritual authority and meditation networks,Global spiritual authority; Meditation enhancement; Inner peace powers; Wisdom networks